{
  "schemaVersion": 1,
  "packageName": "@gaozh1024/rn-kit",
  "version": "0.5.0",
  "role": "core-framework",
  "summary": "Panther Expo Framework core package for app bootstrap, theme, UI, navigation helpers, overlays, and API factory usage in Expo or React Native apps.",
  "entrypoints": [
    {
      "path": ".",
      "kind": "runtime",
      "recommended": true
    },
    {
      "path": "./package.json",
      "kind": "runtime",
      "recommended": false
    }
  ],
  "installation": {
    "packageManagerCommand": "pnpm add @gaozh1024/rn-kit",
    "projectTypes": ["expo", "react-native"],
    "peerDependencies": {
      "@expo/vector-icons": ">=14 <16",
      "expo": ">=53 <55",
      "expo-image": ">=2.4.1 <4",
      "expo-linear-gradient": ">=14 <16",
      "react": ">=18.2.0",
      "react-native": ">=0.79 <0.82",
      "react-native-gesture-handler": ">=2.0.0 <3",
      "react-native-reanimated": ">=3.17.0 <5",
      "react-native-safe-area-context": ">=4.0.0 <6",
      "react-native-screens": ">=4.0.0 <5",
      "react-native-worklets": ">=0.5.0 <0.6.0"
    }
  },
  "recommendedUsage": {
    "minimumSetup": [
      "In Expo projects, install native peer dependencies with expo install before or alongside rn-kit.",
      "Configure NativeWind and Tailwind content scanning to include the consuming app and rn-kit dist output.",
      "If the project uses Expo SDK 54 / RN 0.81, also confirm react-native-worklets compatibility."
    ],
    "primaryProvider": "AppProvider",
    "canonicalTemplate": "templates/expo-starter"
  },
  "stableApis": [
    "AppProvider",
    "ThemeProvider",
    "createTheme",
    "useTheme",
    "AppScreen",
    "AppButton",
    "createAPI",
    "useToggle",
    "SegmentedTabs"
  ],
  "compatibilityNotes": [
    "Current compatibility guidance targets Expo >=53 <55 and React Native >=0.79 <0.82.",
    "Expo SDK 54 maps to React Native 0.81.",
    "AppImage is based on expo-image in rn-kit >= 0.4.6."
  ],
  "antiPatterns": [
    "Installing Expo-native peer dependencies with plain npm latest versions instead of expo install.",
    "Treating missing styles as a ThemeProvider issue before checking NativeWind and Tailwind configuration.",
    "Rebuilding the whole app tree to switch theme when passing isDark to AppProvider or ThemeProvider is sufficient."
  ],
  "canonicalExamples": [
    {
      "name": "app-provider-bootstrap",
      "path": "templates/expo-starter/src/recipes/minimal-bootstrap.tsx"
    },
    {
      "name": "api-factory-usage",
      "path": "templates/expo-starter/src/recipes/api-auth.ts"
    },
    {
      "name": "controlled-theme-toggle",
      "path": "templates/expo-starter/src/recipes/theme-toggle.tsx"
    },
    {
      "name": "segmented-tabs-switcher",
      "path": "templates/expo-starter/src/recipes/segmented-tabs.tsx"
    }
  ],
  "docs": ["README.md", "AI_USAGE.md", "TAILWIND_SETUP.md"]
}
