{
  "schemaVersion": 1,
  "packageName": "@gaozh1024/photo-album-picker",
  "version": "0.3.0",
  "role": "feature-package",
  "summary": "Photo album picker package for Expo or React Native apps with grid selection, fullscreen preview, and optional crop flow.",
  "entrypoints": [
    {
      "path": ".",
      "kind": "runtime",
      "recommended": true
    },
    {
      "path": "./package.json",
      "kind": "runtime",
      "recommended": false
    }
  ],
  "installation": {
    "packageManagerCommand": "pnpm add @gaozh1024/photo-album-picker",
    "projectTypes": ["expo", "react-native"],
    "peerDependencies": {
      "@gaozh1024/rn-kit": ">=0.4.20",
      "@react-navigation/native": ">=7.0.0",
      "@shopify/flash-list": ">=2.0.0",
      "expo": ">=54 <55",
      "expo-image": ">=3 <4",
      "expo-image-manipulator": ">=14 <15",
      "expo-media-library": ">=18 <19",
      "react": ">=18.2.0",
      "react-native": ">=0.79 <0.82",
      "react-native-gesture-handler": ">=2.19.0 <3",
      "react-native-reanimated": ">=3.17.0 <5",
      "react-native-safe-area-context": ">=4 <6",
      "react-native-zoom-toolkit": ">=5 <6"
    }
  },
  "recommendedUsage": {
    "minimumSetup": [
      "Install rn-kit, @react-navigation/native, @shopify/flash-list, react-native-zoom-toolkit, and the listed Expo media dependencies.",
      "Install Expo packages with expo install so versions match the current SDK.",
      "Configure expo-media-library permissions in app.json or app.config.ts and regenerate native projects when using prebuild/dev build."
    ],
    "canonicalTemplate": "templates/expo-starter"
  },
  "stableApis": [
    "MEDIA_PICKER_ROUTES",
    "PhotoAlbumButton",
    "PhotoAlbumGrid",
    "usePhotoAlbum",
    "PhotoAlbumScreen",
    "PhotoCropScreen",
    "normalizeOpenOptions",
    "createCroppedPhotoAlbumItem"
  ],
  "compatibilityNotes": [
    "Current package guidance is validated on Expo SDK 54 with expo-image-manipulator 14.x.",
    "The package depends on rn-kit and React Navigation being present in the consuming app.",
    "Crop mode automatically constrains mediaType and selection count to a single photo."
  ],
  "antiPatterns": [
    "Using npm latest to install expo-image-manipulator in an Expo project instead of expo install.",
    "Opening crop flow without registering PhotoCropScreen.",
    "Expecting this package to upload or persist selected media on behalf of the business app."
  ],
  "canonicalExamples": [
    {
      "name": "album-button-entry",
      "path": "packages/photo-album-picker/src/components/PhotoAlbumButton.tsx"
    },
    {
      "name": "album-screen",
      "path": "packages/photo-album-picker/src/screens/PhotoAlbumScreen.tsx"
    },
    {
      "name": "crop-screen",
      "path": "packages/photo-album-picker/src/screens/PhotoCropScreen.tsx"
    }
  ],
  "docs": ["README.md", "AI_USAGE.md"]
}
